id,name,description,createdAt,updatedAt,ownerId,courseId
0cd7f5f9-9776-488c-bc0e-571498379986,Projects 3,Acervus condico atqui altus viscus patruus.,2025-10-05 23:39:36.803,2025-10-05 23:39:36.803,e8489858-4b4c-4c69-a143-24300bdf84b3,74bfbcee-55f8-417a-8ed8-63dc2f96bc62
0d785a07-5d1d-4635-b8e4-80895c6824b3,Labs 1,Maxime ver crustulum.,2025-10-05 23:39:33.95,2025-10-05 23:39:33.95,a4625a19-9a05-4166-b982-bc36ce18c7c6,3af068ab-c1ab-472e-9243-8b000925dc1f
0e818314-7702-4b94-aa23-e28f92f1e098,Labs 3,Appono alius tripudio versus sol.,2025-10-05 23:39:30.107,2025-10-05 23:39:30.107,06990645-7785-45e9-ad4e-e8dcd2a90444,6d84ec00-d196-4b3e-ab42-720510173769
10842eab-be28-4ef1-ab85-1b17855e2a47,Quizzes 1,Terreo patrocinor cupio vita hic pecco bos quidem.,2025-10-05 23:39:35.157,2025-10-05 23:39:35.157,da5d36c8-0072-42de-875e-ec26eccfef82,5ea385f8-1da7-4113-bc0a-a7b5d6ffb864
1748a913-66fa-4779-b94e-d6d7cfacc7ea,Quizzes 2,Antea vix amita demum.,2025-10-05 23:39:31.725,2025-10-05 23:39:31.725,2cf3a4cf-7e6c-4c4b-816a-827efe86750c,139f7263-47c0-4c6e-9e1a-32b45c4b949c
17fc1c6f-05af-4425-a92d-b9cc04e9d997,Projects 3,Aggredior caute acsi.,2025-10-05 23:39:28.881,2025-10-05 23:39:28.881,55c09bde-da6d-45cd-853f-9de5d7390770,7a9372b0-79e6-4c98-a92b-69be0dddf8c5
1f8dbd45-cf5f-4556-9e68-a8fbd260224e,Projects 3,Sumo claudeo esse sublime.,2025-10-05 23:39:29.497,2025-10-05 23:39:29.497,55c09bde-da6d-45cd-853f-9de5d7390770,2da7d3c4-7978-45a6-92f6-23f75d41d643
21cb79ca-4651-4afb-8646-06113549624a,Homework 3,Aperiam nesciunt suadeo subseco tardus uter desidero sustineo.,2025-10-05 23:39:31.323,2025-10-05 23:39:31.323,2cf3a4cf-7e6c-4c4b-816a-827efe86750c,72516c50-8e2a-4ae5-865f-f9416254669f
24073b2c-5c60-4678-99b2-12e92b08a475,Projects 3,Paens pax statim necessitatibus curto cetera tenuis calamitas.,2025-10-05 23:39:28.273,2025-10-05 23:39:28.273,7db121b9-90e4-458f-9baa-c14a41ad4e03,838d93d8-b123-4f1d-8059-0e8c33031123
27cbc7a9-2fa6-4460-a8c5-e0910a9b36b9,Quizzes 1,Spes spoliatio vinculum clementia ab cernuus blandior somniculosus reiciendis.,2025-10-05 23:39:29.694,2025-10-05 23:39:29.694,06990645-7785-45e9-ad4e-e8dcd2a90444,6d84ec00-d196-4b3e-ab42-720510173769
40a29ea5-840f-4e22-bf3e-0f1dda67d862,Quizzes 2,Acerbitas vomito aiunt torrens cicuta apparatus decerno sequi creator adopto.,2025-10-05 23:39:34.751,2025-10-05 23:39:34.751,da5d36c8-0072-42de-875e-ec26eccfef82,1a24c5ce-04a6-4d2a-b9fd-1aea10c0ee65
44ef446e-58bb-4968-b650-203b0bf25c70,Projects 2,Velociter tollo nostrum sustineo copia saepe deleniti.,2025-10-05 23:39:32.33,2025-10-05 23:39:32.33,50a2f0ef-53f0-43b9-9873-d507451e59e0,6e190522-01b5-452a-b8cb-b99961aa0bda
4943ba01-66b8-4f2a-9a1b-b38e66436c6a,Labs 1,Infit ater clementia sonitus vociferor admitto.,2025-10-05 23:39:29.099,2025-10-05 23:39:29.099,55c09bde-da6d-45cd-853f-9de5d7390770,2da7d3c4-7978-45a6-92f6-23f75d41d643
54ebb240-2a41-442a-8891-59a9ee96c4a0,Labs 3,Crebro bis decipio administratio tracto trepide odio conservo thermae itaque.,2025-10-05 23:39:34.949,2025-10-05 23:39:34.949,da5d36c8-0072-42de-875e-ec26eccfef82,1a24c5ce-04a6-4d2a-b9fd-1aea10c0ee65
57949167-370a-4bc3-856f-4d32a7de942b,Homework 1,Voluntarius atqui suppono adhaero cultura ducimus nobis video spectaculum denique.,2025-10-05 23:39:34.543,2025-10-05 23:39:34.543,da5d36c8-0072-42de-875e-ec26eccfef82,1a24c5ce-04a6-4d2a-b9fd-1aea10c0ee65
624299d8-50ef-4a58-b4d8-b9dcc1c01f15,Quizzes 1,Clibanus calculus cunctatio caput spectaculum trepide speculum tredecim crux aro.,2025-10-05 23:39:27.253,2025-10-05 23:39:27.253,7db121b9-90e4-458f-9baa-c14a41ad4e03,60675058-99df-4d8c-bcb5-4e45d5c42701
684c3b2d-7ed7-4071-b714-c09c3bd8bf12,Labs 2,Speciosus cerno aggredior vulgivagus aro.,2025-10-05 23:39:27.454,2025-10-05 23:39:27.454,7db121b9-90e4-458f-9baa-c14a41ad4e03,60675058-99df-4d8c-bcb5-4e45d5c42701
7af59c11-a14c-4969-b3b7-5a99a91144de,Labs 2,Utrimque labore vitiosus administratio alter adinventitias audax.,2025-10-05 23:39:35.956,2025-10-05 23:39:35.956,e8489858-4b4c-4c69-a143-24300bdf84b3,9ff696a2-c449-4a45-a8d1-cae11c7f09ce
8c1fff00-d221-400e-aba5-d1644862e15e,Quizzes 2,Magni desidero aegrus alii paulatim confugo vero.,2025-10-05 23:39:29.3,2025-10-05 23:39:29.3,55c09bde-da6d-45cd-853f-9de5d7390770,2da7d3c4-7978-45a6-92f6-23f75d41d643
8d001ad6-af2f-47a6-8ffc-02a31313f961,Labs 1,Crebro tumultus arbustum dicta aduro aequitas.,2025-10-05 23:39:35.757,2025-10-05 23:39:35.757,e8489858-4b4c-4c69-a143-24300bdf84b3,9ff696a2-c449-4a45-a8d1-cae11c7f09ce
8e20f760-255d-4d10-9fe4-dd1aa9601551,Labs 3,Adipisci vindico turbo clibanus aetas assentator antepono anser.,2025-10-05 23:39:36.154,2025-10-05 23:39:36.154,e8489858-4b4c-4c69-a143-24300bdf84b3,9ff696a2-c449-4a45-a8d1-cae11c7f09ce
8eb90618-ee21-4b13-8da7-a0f232cd7c02,Homework 2,Pauper non cuius confero antepono cruciamentum.,2025-10-05 23:39:33.553,2025-10-05 23:39:33.553,a4625a19-9a05-4166-b982-bc36ce18c7c6,1d3d8bb7-1a40-4d00-b63c-9e533a92e5fb
8ef01d59-b92e-40f6-bb06-6993a168ecac,Labs 2,Suspendo commodo sono.,2025-10-05 23:39:29.903,2025-10-05 23:39:29.903,06990645-7785-45e9-ad4e-e8dcd2a90444,6d84ec00-d196-4b3e-ab42-720510173769
93b79f93-db72-4563-b0e2-ff8e5142ef88,Homework 1,Suspendo termes angustus a summa consuasor.,2025-10-05 23:39:30.308,2025-10-05 23:39:30.308,06990645-7785-45e9-ad4e-e8dcd2a90444,21fa6426-5847-4889-99ab-f7a3a4fed9dc
9a57425c-de0d-4553-bf4f-9222772c4914,Quizzes 2,Claudeo bene teneo casus uredo ambulo antea volva sperno uberrime.,2025-10-05 23:39:28.066,2025-10-05 23:39:28.066,7db121b9-90e4-458f-9baa-c14a41ad4e03,838d93d8-b123-4f1d-8059-0e8c33031123
9bfab8bd-1778-4284-b9d1-d6148ed656d6,Projects 1,Crustulum temperantia defetiscor cupiditas victus casso animi nulla.,2025-10-05 23:39:32.731,2025-10-05 23:39:32.731,50a2f0ef-53f0-43b9-9873-d507451e59e0,57dcfedf-1ba9-4f59-8c32-0d9a0d5a006d
9c76123f-b8cd-446b-b062-15a45a402366,Homework 3,Bellicus adsum ipsam pariatur uter neque coniuratio thymbra.,2025-10-05 23:39:33.75,2025-10-05 23:39:33.75,a4625a19-9a05-4166-b982-bc36ce18c7c6,1d3d8bb7-1a40-4d00-b63c-9e533a92e5fb
a083cc3c-dd4f-462f-ae98-08afee0c7eb6,Labs 1,Contabesco vox stella vir.,2025-10-05 23:39:36.393,2025-10-05 23:39:36.393,e8489858-4b4c-4c69-a143-24300bdf84b3,74bfbcee-55f8-417a-8ed8-63dc2f96bc62
a2c1a446-1fb7-4246-9586-c93d67dbe3cd,Labs 3,Ait adstringo amiculum occaecati illum canis reprehenderit.,2025-10-05 23:39:31.925,2025-10-05 23:39:31.925,2cf3a4cf-7e6c-4c4b-816a-827efe86750c,139f7263-47c0-4c6e-9e1a-32b45c4b949c
a44eb6cc-b752-42d9-a363-53b9cece295b,Projects 3,Cui ancilla vacuus cuppedia crepusculum.,2025-10-05 23:39:33.148,2025-10-05 23:39:33.148,50a2f0ef-53f0-43b9-9873-d507451e59e0,57dcfedf-1ba9-4f59-8c32-0d9a0d5a006d
a5d4beda-c083-4d0c-b67a-e6f4d0ed6814,Labs 1,Acies cinis decipio provident.,2025-10-05 23:39:31.53,2025-10-05 23:39:31.53,2cf3a4cf-7e6c-4c4b-816a-827efe86750c,139f7263-47c0-4c6e-9e1a-32b45c4b949c
a6200517-3807-4be5-8a50-a1b0be54aa2c,Homework 3,Aggero decimus ascit audacia balbus crepusculum admoneo cubicularis.,2025-10-05 23:39:35.559,2025-10-05 23:39:35.559,da5d36c8-0072-42de-875e-ec26eccfef82,5ea385f8-1da7-4113-bc0a-a7b5d6ffb864
a75064cb-d147-4b36-acaf-89b2c35f4925,Labs 2,Vulnero nostrum tonsor compello cohaero culpa spectaculum statim comburo.,2025-10-05 23:39:31.117,2025-10-05 23:39:31.117,2cf3a4cf-7e6c-4c4b-816a-827efe86750c,72516c50-8e2a-4ae5-865f-f9416254669f
a76312bb-637c-4cdd-beff-34068ca5e29a,Labs 2,Adulatio peccatus tenax eos.,2025-10-05 23:39:35.365,2025-10-05 23:39:35.365,da5d36c8-0072-42de-875e-ec26eccfef82,5ea385f8-1da7-4113-bc0a-a7b5d6ffb864
aa2dd224-7ab5-4db5-8ffe-56924c27df7a,Projects 1,Atqui votum decor.,2025-10-05 23:39:30.905,2025-10-05 23:39:30.905,2cf3a4cf-7e6c-4c4b-816a-827efe86750c,72516c50-8e2a-4ae5-865f-f9416254669f
af5baed8-1fcd-440f-8de2-ef1c57c12fe0,Homework 2,Itaque aestus abeo spargo sapiente cunctatio.,2025-10-05 23:39:36.595,2025-10-05 23:39:36.595,e8489858-4b4c-4c69-a143-24300bdf84b3,74bfbcee-55f8-417a-8ed8-63dc2f96bc62
be2fdca4-39d1-4fee-8654-8cd17a3f7307,Labs 1,Quibusdam tametsi blanditiis adulatio.,2025-10-05 23:39:28.474,2025-10-05 23:39:28.474,55c09bde-da6d-45cd-853f-9de5d7390770,7a9372b0-79e6-4c98-a92b-69be0dddf8c5
c82a3152-8ce7-49c0-828c-548181c77ad1,Quizzes 1,Deripio strenuus casus.,2025-10-05 23:39:32.128,2025-10-05 23:39:32.128,50a2f0ef-53f0-43b9-9873-d507451e59e0,6e190522-01b5-452a-b8cb-b99961aa0bda
c8bb194f-4279-4536-8ba4-0e03167c4d97,Projects 2,Argentum damnatio patior aggero.,2025-10-05 23:39:34.145,2025-10-05 23:39:34.145,a4625a19-9a05-4166-b982-bc36ce18c7c6,3af068ab-c1ab-472e-9243-8b000925dc1f
cf154bc2-04f0-4d84-9170-fdb46ff5614e,Homework 2,Ulciscor adinventitias tabernus confugo demum vestrum conatus.,2025-10-05 23:39:28.681,2025-10-05 23:39:28.681,55c09bde-da6d-45cd-853f-9de5d7390770,7a9372b0-79e6-4c98-a92b-69be0dddf8c5
d2a3388d-1732-4843-8288-0f56c512a2f3,Quizzes 3,Ocer tribuo aggero demoror quod tribuo terra charisma vilicus.,2025-10-05 23:39:34.346,2025-10-05 23:39:34.346,a4625a19-9a05-4166-b982-bc36ce18c7c6,3af068ab-c1ab-472e-9243-8b000925dc1f
d3a5adb5-3f76-42a8-8ef7-3ae2ccbb14d0,Quizzes 2,Aduro confido dicta arx solus vulpes.,2025-10-05 23:39:32.946,2025-10-05 23:39:32.946,50a2f0ef-53f0-43b9-9873-d507451e59e0,57dcfedf-1ba9-4f59-8c32-0d9a0d5a006d
d4fef39e-0a27-4607-9054-836be379d84f,Labs 3,Ago inflammatio crastinus pectus creta caput alius.,2025-10-05 23:39:30.706,2025-10-05 23:39:30.706,06990645-7785-45e9-ad4e-e8dcd2a90444,21fa6426-5847-4889-99ab-f7a3a4fed9dc
e03d6f79-ab7c-4c83-881b-087703d2dc3e,Labs 1,Socius aduro torqueo vilicus sodalitas virtus.,2025-10-05 23:39:33.347,2025-10-05 23:39:33.347,a4625a19-9a05-4166-b982-bc36ce18c7c6,1d3d8bb7-1a40-4d00-b63c-9e533a92e5fb
eec705a9-dd2b-42cf-9faa-b979cf14f29a,Quizzes 3,Thalassinus soluta nesciunt usitas clam delibero quaerat cunctatio cursus comprehendo.,2025-10-05 23:39:27.66,2025-10-05 23:39:27.66,7db121b9-90e4-458f-9baa-c14a41ad4e03,60675058-99df-4d8c-bcb5-4e45d5c42701
f0bff14b-9b86-430c-b060-e19d9fd3d575,Projects 2,Harum ullus vita.,2025-10-05 23:39:30.51,2025-10-05 23:39:30.51,06990645-7785-45e9-ad4e-e8dcd2a90444,21fa6426-5847-4889-99ab-f7a3a4fed9dc
f84b992f-4c8c-42b1-87ea-b254bc33da26,Homework 3,Iure contego vere accusator comedo adstringo tener subvenio.,2025-10-05 23:39:32.53,2025-10-05 23:39:32.53,50a2f0ef-53f0-43b9-9873-d507451e59e0,6e190522-01b5-452a-b8cb-b99961aa0bda
fcd80738-202f-4cee-91b0-f8b137d80377,Labs 1,Baiulus victus strenuus trans iure tergum acceptus toties adhaero.,2025-10-05 23:39:27.865,2025-10-05 23:39:27.865,7db121b9-90e4-458f-9baa-c14a41ad4e03,838d93d8-b123-4f1d-8059-0e8c33031123