id,name,description,createdAt,updatedAt,ownerId
139f7263-47c0-4c6e-9e1a-32b45c4b949c,Realigned 24 hour matrices 345,Carbo summopere aliqua aveho utpote taceo abutor carpo.,2025-10-05 23:39:19.195,2025-10-05 23:39:19.195,2cf3a4cf-7e6c-4c4b-816a-827efe86750c
1a24c5ce-04a6-4d2a-b9fd-1aea10c0ee65,Balanced immersive system engine 142,Cunae sollers caveo artificiose arto aeneus audax sonitus uxor.,2025-10-05 23:39:21.066,2025-10-05 23:39:21.066,da5d36c8-0072-42de-875e-ec26eccfef82
1d3d8bb7-1a40-4d00-b63c-9e533a92e5fb,Business-focused fault-tolerant system engine 333,Censura corporis vehemens sophismata tersus defetiscor quod.,2025-10-05 23:39:20.33,2025-10-05 23:39:20.33,a4625a19-9a05-4166-b982-bc36ce18c7c6
21fa6426-5847-4889-99ab-f7a3a4fed9dc,Public-key global access 333,Defaeco vita cubitum tumultus audio.,2025-10-05 23:39:18.433,2025-10-05 23:39:18.433,06990645-7785-45e9-ad4e-e8dcd2a90444
2da7d3c4-7978-45a6-92f6-23f75d41d643,Compatible methodical middleware 359,Accendo vociferor casso spes suffoco.,2025-10-05 23:39:17.71,2025-10-05 23:39:17.71,55c09bde-da6d-45cd-853f-9de5d7390770
3af068ab-c1ab-472e-9243-8b000925dc1f,Expanded optimal hardware 277,Video adversus tredecim clarus decor acer coerceo desolo.,2025-10-05 23:39:20.699,2025-10-05 23:39:20.699,a4625a19-9a05-4166-b982-bc36ce18c7c6
57dcfedf-1ba9-4f59-8c32-0d9a0d5a006d,Sharable static task-force 317,Provident talus taceo eligendi.,2025-10-05 23:39:19.941,2025-10-05 23:39:19.941,50a2f0ef-53f0-43b9-9873-d507451e59e0
5ea385f8-1da7-4113-bc0a-a7b5d6ffb864,Sharable neutral array 215,Carus dolorum facilis consuasor considero.,2025-10-05 23:39:21.482,2025-10-05 23:39:21.482,da5d36c8-0072-42de-875e-ec26eccfef82
60675058-99df-4d8c-bcb5-4e45d5c42701,Progressive modular collaboration 267,Ambitus chirographum charisma custodia vomer aegre earum attero voluntarius.,2025-10-05 23:39:16.587,2025-10-05 23:39:16.587,7db121b9-90e4-458f-9baa-c14a41ad4e03
6d84ec00-d196-4b3e-ab42-720510173769,Polarised eco-centric data-warehouse 339,Vindico amiculum arma vinco tabgo vacuus balbus ocer substantia.,2025-10-05 23:39:18.071,2025-10-05 23:39:18.071,06990645-7785-45e9-ad4e-e8dcd2a90444
6e190522-01b5-452a-b8cb-b99961aa0bda,Enhanced discrete core 125,Tabella pectus speculum aggredior virgo tum.,2025-10-05 23:39:19.565,2025-10-05 23:39:19.565,50a2f0ef-53f0-43b9-9873-d507451e59e0
72516c50-8e2a-4ae5-865f-f9416254669f,Progressive zero defect archive 103,Aliquam tamisium vergo damno caute damno.,2025-10-05 23:39:18.81,2025-10-05 23:39:18.81,2cf3a4cf-7e6c-4c4b-816a-827efe86750c
74bfbcee-55f8-417a-8ed8-63dc2f96bc62,Sustainable neutral software 443,Decens pel arto speculum attero suasoria calculus angulus.,2025-10-05 23:39:22.218,2025-10-05 23:39:22.218,e8489858-4b4c-4c69-a143-24300bdf84b3
7a9372b0-79e6-4c98-a92b-69be0dddf8c5,Focused national toolset 341,Aestivus virgo clibanus.,2025-10-05 23:39:17.345,2025-10-05 23:39:17.345,55c09bde-da6d-45cd-853f-9de5d7390770
838d93d8-b123-4f1d-8059-0e8c33031123,Cross-platform full-range policy 381,Conor cubicularis celo basium denuncio censura.,2025-10-05 23:39:16.974,2025-10-05 23:39:16.974,7db121b9-90e4-458f-9baa-c14a41ad4e03
9ff696a2-c449-4a45-a8d1-cae11c7f09ce,Stand-alone scalable encoding 465,Compello conspergo dicta vilis utor ambulo crudelis ipsum desolo aut.,2025-10-05 23:39:21.864,2025-10-05 23:39:21.864,e8489858-4b4c-4c69-a143-24300bdf84b3